IsPlayer,Timing,Any,Face_Any,Red,Face_Red,Green,Face_Green,Blue,Face_Blue
t,t,,,"実は週末…海沿いの街に行くんです。いわゆる、聖地巡礼ってやつです。",,週末は…海を見に行こうかと。何もない、静かな港町なんですけど。,,"極東の最果て"へ向かいます。ある重要なミッションを遂行するために。,
f,t,,,"聖地…巡礼？ それって、お寺とか神社を回るやつ？",Surprise,"ロマンチックだねぇ。傷心旅行？ それとも自分探しの旅？",Normal,"ミッション！？ 何それ、スパイ映画みたいで面白そう！",Laugh
t,t,,,"いえ、神様じゃなくて…。好きな作品の舞台になった場所なんです。",,そんなかっこいいもんじゃ…。ただ、好きな景色の中に身を置きたいだけで。,,"機密事項"です。…と言いたいですが、ただのアニメショップ巡りです。,
f,t,,,"作品の舞台…？ あ、ドラマのロケ地巡りとか、そういうの？",Normal,"素敵だと思うよ。好きな場所にいる時の空気って、特別だもんね。",Smile,"なーんだ。でも、遷宮寺くんにしては活動的だね。",Laugh
t,t,,,"…はい。アニメなんですけどね。その街に行かないと見えない景色があるんです。",,画面越しじゃなくて、自分の目で見たいんです。その空気を吸いたくて。,,"限定グッズ"戦争です。負けられない戦いが、そこにはあるんです。,
f,t,,,"アニメ…！ そ、そうなんだ。…詳しく聞かせてもらおうかな。",Surprise,"熱意が伝わってくるよ。…私も、そういうの嫌いじゃないな。",Smile,"戦士の目をしてる…。うん、お土産話、期待してるね。",Laugh