IsPlayer,Timing,Any,Face_Any,Red,Face_Red,Green,Face_Green,Blue,Face_Blue
t,t,,,"ペンキは水性より油性がいいです。発色が段違いだし、魂が乗るんです。",,筆は使い分けましょう。弘法は筆を選ばずと言いますが、僕は選びます。,,"塗料の呼吸"…なんちゃって。全集中で塗らないとムラになりますよ。,
f,t,,,"へぇ…詳しいね！ 美術部とかじゃなかったんだよね？",Surprise,"こだわりがあるんだね。そういう職人気質なところ、意外かも。",Normal,"あはは！ 流行りのやつだ。遷宮寺くんも漫画とか読むんだね。",Laugh
t,t,,,"あ、いえ！ プラモデル…じゃなくて、日曜大工で少々かじった程度です。",,道具を愛でるのも趣味のうちというか…。形から入るタイプなんです。,,"伝説の剣"を作るつもりで塗ります。学祭の看板ですけど。,
f,t,,,"手先が器用なんだね。今度、私の壊れたアクセサリーも直してほしいな。",Smile,"大事だよね、形から入るの。モチベーション上がるし。",Normal,"勇者様だ！ じゃあ私は魔法使い役でサポートするね。",Smile
t,t,,,"任せてください。…その、細かい作業はずっとやってきたんで。",,段ボールも、断面を強化すれば木材に匹敵する素材になるんです。,,"エクスカリバー"級の看板に仕上げてみせますよ。期待しててください。,
f,t,,,"ふふっ、頼もしいなぁ。遷宮寺くんって、実は凝り性？",Smile,"へぇー！ すごい知識。…なんか、新しい一面を見た気がする。",Surprise,"大きく出たねぇ。完成したら、聖剣として校庭に突き刺しておこうか。",Laugh