IsPlayer,Timing,Any,Face_Any,Red,Face_Red,Green,Face_Green,Blue,Face_Blue
t,f,,,"週末は友達とクラブでオールっすね。DJとか回しちゃって。",,休日は友達とファミレスで語り合うことが多いですね。,,こ、公園の鳩と対話してます。「クルックー」って。",
f,f,,,"へぇ…DJできるんだ。意外と派手な遊びしてるんだね。",Surprise,"仲良いね。そういう時間って大事だよね。",Normal,"鳩（笑） 遷宮寺くん、やっぱり疲れてるんじゃない？",Laugh
t,f,,,"告白されすぎて困っちゃうんですよ。罪な男です、僕は。",,今は勉強と委員会が恋人です。…なんて、強がりですけど。,,"二次元しか愛せません。画面の向こうが僕の故郷なんです。",
f,f,,,"モテモテだね〜。私とは住む世界が違うかも。",Awkward,"真面目だなぁ。でも、たまには息抜きもしないとね。",Smile,"故郷って（笑） でも、推しがいるって幸せなことだよね。",Normal
t,f,,,"今度、僕の主催するパーティーに来ませんか？ VIP席用意しますよ。",,先輩はサークルの友達とどこか行ったりしないんですか？,,僕と契約して、魔法少女になってくれませんか？",
f,f,,,"えー、遠慮しとく。キラキラした場所、苦手だから。",Sad,"行くよ、たまにね。……たまに、だけど。",Normal,"わけわかんない（笑） でも、その発想力は嫌いじゃないかな。",Laugh