IsPlayer,Timing,Any,Face_Any,Red,Face_Red,Green,Face_Green,Blue,Face_Blue
t,f,,,"じゅ、授業なんて楽勝ですよ。教授とマブダチなんで！（大嘘）",,単位取るのって大変ですよね。先輩はどうしてます？,,きょ、教授のモノマネが得意なんです。「えー、ここはだな…」,
f,f,,,"さすがだなぁ。私なんて、課題に追われてばっかりだよ。",Smile,"真面目にやってれば大丈夫だよ。ノート貸してあげようか？",Normal,"ふふっ、似てるかも（笑） でも本人に聞かれたら怒られるよ？",Laugh
t,f,,,"ノートなんて不要です！ 全てこの頭脳に入ってますから！（震え）",,ぜひお願いします！ 先輩のノート、綺麗なんだろうなぁ。,,"教授のカツラがズレた時、どう反応するのが正解ですかね？",
f,f,,,"すごい自信…。天才肌なんだね、遷宮寺くんは。",Surprise,"そんなことないよ。殴り書きだし、恥ずかしいな。",Shameful,"見なかったことにするのが大人のマナーだよ。…多分ね。",Awkward
t,f,,,"テスト前は、みんなに勉強教えてるんです。カリスマ講師として。",,テスト期間中って、図書館混んでて困りますよね。,,"テスト用紙を破り捨てて、窓から飛び出したくなりますよね！",
f,f,,,"へぇ〜、偉いね。私も教えてもらおうかな。",Smile,"そうだね。席取り合戦、毎回負けちゃうんだよね…。",Sad,"あはは！ 気持ちは分かるけど、単位も飛んでっちゃうよ？",Laugh